Book,Authors,Jornal,Year,Publisher,Link
Gestão da Diversidade: Uma Gestão Necessária para Estimular a Inovação e Aumentar a Competitividade das Empresas de Contabilidade e Auditoria,"JA da Silva Cardoso, JR de Farias Filho… ",2014,2014,researchgate.net,https://www.researchgate.net/profile/Ualison-Oliveira/publication/279660477_Gestao_da_diversidade_uma_gestao_necessaria_para_estimular_a_inovacao_e_aumentar_a_competitividade_das_empresas_de_contabilidade_e_auditoria/links/5b1026834585150a0a5dfc68/Gestao-da-diversidade-uma-gestao-necessaria-para-estimular-a-inovacao-e-aumentar-a-competitividade-das-empresas-de-contabilidade-e-auditoria.pdf
GESTÃO DA DIVERSIDADE: A DESIGUALDADE DE GÊNERO EM UMA ORGANIZAÇÃO DO RAMO OFFSHORE EM MACAÉ/RJ,"LCM Valério, AS Figueiredo",Revista Femass,2021,revista.femass.edu.br,https://revista.femass.edu.br/index.php/femass/article/view/53
PRÁTICAS MODERNAS DA GESTÃO DE PESSOAS: VALORIZAÇÃO NA GESTÃO DAS DIVERSIDADES,OIR da SILVA,ANAIS DO FÓRUM DE,2017,seer.unifunec.edu.br,https://seer.unifunec.edu.br/index.php/forum/article/view/3113
"Uma análise da relação entre a gestão da diversidade, a identificação organizacional ea voz das minorias nas organizações.",BS Isidoro ,2019,2019,monografias.ufop.br,http://monografias.ufop.br/handle/35400000/2194
Gestão da diversidade nas melhores empresas para mulheres trabalharem: investigação a partir das práticas divulgadas,MT Bastos ,2014,2014,repositorio.fei.edu.br,https://repositorio.fei.edu.br/handle/FEI/238
Práticas de Gestão da Diversidade de pessoas com deficiência e/ou incapacidade:: O caso da Câmara Municipal da Póvoa de Varzim,"Â Teixeira, D Martins, AL Martinho",Conferência,Conferência,"Investigação e…, 2019",https://parc.ipp.pt/index.php/iirh/article/view/2826
"Conceitos, práticas e estudo de casos da gestão da diversidade em empresas do centro oeste paulista",FS Gordono ,2009,2009,repositorio.unesp.br,https://repositorio.unesp.br/handle/11449/94776
